{
  "id": "state.sampleco.contract.harbor",
  "type": "obligation",
  "primary_family": "work",
  "secondary_families": ["governance", "relationship", "operating"],
  "state_traits": ["dynamic"],
  "scope": "organization.sampleco.contracts.harbor",
  "owner_refs": ["persona.alex"],
  "as_of": "2026-04-28T14:16:00Z",
  "summary": "Harbor remains an operational contract obligation under internal clarification; owner, stage, next action, and canonical Drive archive need confirmation before any external follow-up is proposed.",
  "status": "waiting_on_internal",
  "situations": [
    {
      "id": "situation.harbor-contract-record-stale",
      "label": "Harbor contract record is stale",
      "state": "investigating",
      "rationale": "The record has enough signal to warrant operational review, but not enough evidence to mark the obligation ready, done, or externally actionable."
    }
  ],
  "goals": [
    "Identify the accountable owner for Harbor contract follow-up.",
    "Confirm the current contract stage from the canonical source.",
    "Link the retained Drive record or identify the missing archive gap.",
    "Create only internal follow-up until approval authority is clear."
  ],
  "blockers": [
    "Current contract stage is not evidenced.",
    "Canonical Drive archive reference is missing.",
    "External-action authority is not established."
  ],
  "open_questions": [
    "Who owns Harbor contract follow-up?",
    "What is the current Harbor contract stage?",
    "Where is the canonical Drive document or retained archive reference?",
    "What internal approval is needed before any external contract action?"
  ],
  "next_actions": [
    {
      "id": "action.alex.harbor-contract-clarify",
      "summary": "Alex should identify the owner, current stage, next action, and canonical Drive reference before any external follow-up is proposed.",
      "owner_ref": "persona.alex",
      "status": "active"
    }
  ],
  "evidence_refs": [
    "sampleco-process/pipeline/ops-manager-operating-model.md",
    "state.sampleco.contract.harbor",
    "journal.sampleco.contract.harbor.stale-review"
  ],
  "parent_state_refs": [
    "state.sampleco.operating_picture.ops"
  ],
  "child_state_refs": [],
  "latest_journal_entry_id": "journal.sampleco.contract.harbor.stale-review"
}
